{
  "plan_id": "01HXABC123DEF456GHJ789KLM1",
  "intent_id": "01HXABC123DEF456GHJ789KLM0",
  "workflow_id": "lead_qualification",
  "workflow_version": "1.3.0",
  "agent_role": "lead_qualifier",
  "policy_snapshot": {
    "capabilities_granted": ["crm_read", "email_send"],
    "budget_class": "standard",
    "budget_remaining_usd": 10.00,
    "kill_switch": "off",
    "circuit_state": "closed"
  },
  "steps": [
    {
      "step_id": "classify",
      "tool_name": "classify_lead_intent",
      "tool_version": "1.0.0",
      "model_class": "low_cost_extract",
      "execution_mode": "probabilistic",
      "input_schema_ref": "lead_intent_input@v1",
      "output_schema_ref": "lead_intent_output@v1",
      "depends_on": [],
      "approval_gate": false,
      "fallback_strategy": {
        "max_retries": 2,
        "fallback_tool": "classify_lead_intent_fallback",
        "degrade_to_class": "low_cost_extract_alt"
      }
    }
  ],
  "termination_guard": {
    "max_chain_depth": 5,
    "max_total_cost_usd": 5.00,
    "monotone_cost_on_degrade": true
  },
  "created_at": "2026-04-26T12:00:00Z",
  "signed_by": "paperclipai@v0.1.0"
}
